original_label,normalized_label,fine_label,coarse_label,is_known,mapping_role,usage_if_included,include_in_manifest,license_notes,mapping_notes
Cardboard,cardboard,paper_cardboard,recyclable,true,known_train_candidate,known_split,true,CC BY-NC-SA 4.0,Clear mapping to paper_cardboard.
Food Organics,food_organics,organic,organic,true,known_train_candidate,known_split,true,CC BY-NC-SA 4.0,Clear mapping to organic.
Glass,glass,glass,recyclable,true,known_train_candidate,known_split,true,CC BY-NC-SA 4.0,Clear mapping to glass.
Metal,metal,metal,recyclable,true,known_train_candidate,known_split,true,CC BY-NC-SA 4.0,Clear mapping to metal.
Miscellaneous Trash,miscellaneous_trash,residual,residual,true,known_train_candidate,known_split,true,CC BY-NC-SA 4.0,Mapped to residual because it represents general trash.
Paper,paper,paper_cardboard,recyclable,true,known_train_candidate,known_split,true,CC BY-NC-SA 4.0,Clear mapping to paper_cardboard.
Plastic,plastic,plastic,recyclable,true,known_train_candidate,known_split,true,CC BY-NC-SA 4.0,Clear mapping to plastic.
Textile Trash,textile_trash,unknown,unknown,false,future_class_candidate,unknown_test,true,CC BY-NC-SA 4.0,Outside current known taxonomy; keep as unknown/future class candidate.
Vegetation,vegetation,organic,organic,true,known_train_candidate,known_split,true,CC BY-NC-SA 4.0,Vegetation is mapped to organic.